drug	usage
Phentolamine	Used as an aid for the diagnosis of pheochromocytoma, and may be administered immediately prior to or during pheochromocytomectomy to prevent or control paroxysmal hypertension resulting from anesthesia, stress, or operative manipulation of the tumor. Phentolamine has also been used to treat hypertensive crisis caused by sympathomimetic amines or catecholamine excess by certain foods or drugs in patients taking MAO inhibitors, or by clonidine withdrawal syndrome. Other indications include the prevention of dermal necrosis and sloughing following IV administration or extravasation of norepinephrine, decrease in impedance to left ventricular ejection and the infarct size in patients with MI associated with left ventricular failure, treatment of erectile dysfunction through self-injection of small doses combined with papaverine hydrochloride into the corpus cavernosum, and as an adjunct to the management of cocaine overdose to reverse coronary vasoconstriction following use of oxygen, benzodiazepines,and nitroglycerin.
Fluorescein	For diagnostic imaging. Primarily indicated in diagnostic fluorescein angiography or angioscopy of the fundus and of the iris vasculature
Daunorubicin	For remission induction in acute nonlymphocytic leukemia (myelogenous, monocytic, erythroid) of adults and for remission induction in acute lymphocytic leukemia of children and adults
Furosemide	For the treatment of edema associated with congestive heart failure, cirrhosis of the liver, and renal disease, including the nephrotic syndrome. Also for the treatment of hypertension alone or in combination with other antihypertensive agents
Ergotamine	For use as therapy to abort or prevent vascular headache, e.g., migraine, migraine variants, or so called "histaminic cephalalgia"
Tizanidine	For the management of increased muscle tone associated with spasticit
Nitrofurantoin	May be used as an alternative in the treatment of urinary tract infections. May be used by females pericoitally for prophylaxis against recurrent cystitis related to coitus.
Nicergoline	For the treatment of senile dementia, migraines of vascular origin, transient ischemia, platelet hyper-aggregability, and macular degeneration
Eplerenone	For improvement of survival of stable patients with left ventricular systolic dysfunction (ejection fraction &lt;40%) and clinical evidence of congestive heart failure after an acute myocardial infarction
Amprenavir	For the treatment of HIV-1 infection in combination with other antiretroviral agents
Icodextrin	Used for continuous ambulatory peritoneal dialysis (CAPD) of diabetic patients or automated peritoneal dialysis (APD) for the management of end-stage renal disease
Methazolamide	For treatment of chronic open-angle glaucoma and acute angle-closure glaucom
Naltrexone	Used as an adjunct to a medically supervised behaviour modification program in the maintenance of opiate cessation in individuals who were formerly physically dependent on opiates and who have successfully undergone detoxification. Also used for the management of alcohol dependence in conjunction with a behavioural modification program
Delavirdine	For the treatment of HIV-1 infection in combination with appropriate antiretroviral agents when therapy is warrante
Tamsulosin	Used in the treatment of signs and symptoms of benign prostatic hyperplasia (reduction in urinary obstruction and relief of associated manifestations such as hesitancy, terminal dribbling of urine, interrupted or weak stream...etc.
Porfimer sodium	Indicated in the treatment of esophageal cancer
Sufentanil	Used as an analgesic adjunct in anesthesia and as a primary anesthetic drug in procedures requiring assisted ventilation and in the relief of pain
Lamivudine	For the treatment of HIV infection and chronic hepatitis B (HBV)
Ibandronate	For the treatment and prevention of osteoporosis in postmenopausal women
Diethylcarbamazine	Used for the treatment of individual patients with certain filarial diseases including tropical pulmonary eosinophilia, loiasis, and lymphatic filariasis caused by infection with &lt;i&gt;Wuchereria bancrofti&lt;/i&gt;, &lt;i&gt;Brugia malayi&lt;/i&gt;, or &lt;i&gt;Brugia timori&lt;/i&gt;
Flurbiprofen	Flurbiprofen tablets are indicated for the acute or long-term symptomatic treatment of rheumatoid arthritis, osteorarthritis and anklosing spondylitis. It may also be used to treat pain associated with dysmenorrhea and mild to moderate pain accompanied by inflammation (e.g. bursitis, tendonitis, soft tissue trauma). Topical ophthalmic formulations may be used pre-operatively to prevent intraoperative miosis.
Oxacillin	Used in the treatment of resistant staphylococci infections
Apomorphine	For the acute, intermittent treatment of hypomobility, off episodes (end-of-dose wearing off and unpredictable on/off episodes) associated with advanced Parkinson's disease
Paroxetine	Labeled indications include: major depressive disorder (MDD), panic disorder with or without agoraphobia, obsessive-compulsive disorder (OCD), social anxiety disorder (social phobia), generalized anxiety disorder (GAD), post-traumatic stress disorder (PTSD), and premenstrual dysphoric disorder (PMDD). Unlabeled indications include: eating disorders, impulse control disorders, vasomotor symptoms of menopause, obsessive-compulsive disorder (OCD) in children, and mild dementia-associated agitation in nonpsychotic individuals. Brisdelle, which consists of paroxetine mesylate is indicated for the treatment of moderate to severe vasomotor symptoms (like hot flashes) associated with menopause.
Nedocromil	For the treatment of mild to moderate asthm
Norethisterone	For the treatment of secondary amenorrhea, endometriosis, and abnormal uterine bleeding due to hormonal imbalance in the absence of organic pathology, such as submucous fibroids or uterine cancer
Adefovir Dipivoxil	For the treatment of chronic hepatitis B in adults with evidence of active viral replication and either evidence of persistent elevations in serum aminotransferases (ALT or AST) or histologically active disease
Azatadine	For the relief of the symptoms of upper respiratory mucosal congestion in perennial and allergic rhinitis, and for the relief of nasal congestion and eustachian t.b. congestion
Clodronic Acid	For the management of hypercalcemia of malignancy and as an adjunct in the management of osteolysis resulting from bone metastases of malignant tumors
Procaine	Used as a local anesthetic primarily in oral surger
Lisinopril	For the treatment of hypertension and symptomatic congestive heart failure. May be used in conjunction with thrombolytic agents, aspirin and/or &amp;beta;-blockers to improve survival in hemodynamically stable individuals following myocardial infarction. May be used to slow the progression of renal disease in hypertensive patients with diabetes mellitus and microalbuminuria or overt nephropathy.
Methoxamine	Indicated for the treatment and management of hypotension
Imiquimod	For the topical treatment of clinically typical, nonhyperkeratotic, nonhypertrophic actinic keratoses on the face or scalp in immunocompetent adults. Also indicated for the treatment of external genital and perianal warts/condyloma acuminata in individuals 12 years old and above
Homatropine Methylbromide	Used in conjunction with antacids or histamine H2-receptor antagonists in the treatment of peptic ulcers, gastric ulcers and duodenal ulcers, to reduce further gastric acid secretion and delay gastric emptying
Trimipramine	For the treatment of depression and depression accompanied by anxiety, agitation or sleep disturbanc
Nitroglycerin	For the prevention of angin
Rocuronium	For inpatients and outpatients as an adjunct to general anesthesia to facilitate both rapid sequence and routine tracheal intubation, and to provide skeletal muscle relaxation during surgery or mechanical ventilation
Diphemanil Methylsulfate	Used in the treatment of peptic ulcer, gastric hyperacidity, and hypermotility in gastritis and pylorospasm, and in the treatment of hyperhidrosis (excessive perspiration)
Thiabendazole	For the treatment of strongyloidiasis (threadworm), cutaneous larva migrans (creeping eruption), visceral larva migrans, and trichinosis
Nateglinide	For the treatment of non-insulin dependent-diabetes mellitus in conjunction with diet and exercise
Atracurium besylate	For use, as an adjunct to general anesthesia, to facilitate endotracheal intubation and to provide skeletal muscle relaxation during surgery or mechanical ventilation
Pralidoxime	For the treatment of poisoning due to those pesticides and chemicals of the organophosphate class which have anticholinesterase activity and in the control of overdosage by anticholinesterase drugs used in the treatment of myasthenia gravis
Risperidone	Risperidone belongs to the class of medications known as ​second generation atypical antipsychotics [A1114, A1115, L1213].  It is widely used in the treatment of schizophrenia and mood disorders, including bipolar disorder and depression with pyschosis [A1115, A1116, L1212, L1213]
Naftifine	For the topical treatment of tinea pedis, tinea cruris, and tinea corporis caused by the organisms &lt;i&gt;Trichophyton rubrum&lt;/i&gt;, &lt;i&gt;Trichophyton mentagrophytes&lt;/i&gt;, &lt;i&gt;Trichophyton tonsurans&lt;/i&gt; and &lt;i&gt;Epidermophyton floccosum&lt;/i&gt;
Esomeprazole	For the treatment of acid-reflux disorders (GERD), peptic ulcer disease, H. pylori eradication, and prevention of gastroinetestinal bleeds with NSAID use
Meclizine	For the prevention and treatment of nausea, vomiting, or dizziness associated with motion sickness
Pentamidine	For the treatment of pneumonia due to &lt;i&gt;Pneumocystis carinii&lt;/i&gt;
Hetacillin	Hetacillin is a beta-lactam antibiotic prodrug used to treat bacterial infections. In the body it gets converted to ampicillin
Riluzole	For the treatment of amyotrophic lateral sclerosis (ALS, Lou Gehrig's Disease
Hydrocortisone	For the relief of the inflammatory and pruritic manifestations of corticosteroid-responsive dermatoses. Also used to treat endocrine (hormonal) disorders (adrenal insufficiency, Addisons disease). It is also used to treat many immune and allergic disorders, such as arthritis, lupus, severe psoriasis, severe asthma, ulcerative colitis, and Crohn's disease
Mannitol	Used for the promotion of diuresis before irreversible renal failure becomes established, the reduction of intracranial pressure, the treatment of cerebral edema, and the promotion of urinary excretion of toxic substances
Gadobenic acid	Gadobenate Dimeglumine is an MRI contrast agent used primarily for MR imaging of the liver. It can also be used for MRI of the heart, as well as and central nervous system in adults to visualize lesions with abnormal brain vascularity or abnormalities in the blood brain barrier, the brain, spine, or other associated tissues
Zileuton	For the prophylaxis and chronic treatment of asthma in adults and children 12 years of age and older
Modafinil	To improve wakefulness in patients with excessive daytime sleepiness (EDS) associated with narcolepsy
Deferoxamine	Used to treat acute iron or aluminum toxicity (an excess of aluminum in the body) in certain patients. Also used in certain patients with anemia who must receive many blood transfusions
Scopolamine	For the treatment of excessive salivation, colicky abdominal pain, bradycardia, sialorrhoea, diverticulitis, irritable bowel syndrome and motion sickness
Carbinoxamine	For symptomatic relief of seasonal and perennial allergic rhinitis and vasomotor rhinitis, as well as allergic conjunctivitis caused by foods and inhaled allergens. Also for the relief of allergic reactions to blood or plasma, and the symptomatic management of mild, uncomplicated allergic skin manifestations of urticaria and angioedema
Etodolac	For acute and long-term management of signs and symptoms of osteoarthritis and rheumatoid arthritis, as well as for the management of pain
Prilocaine	Used as a local anaesthetic and is often used in dentistry
Epinastine	For the prevention of itching associated with allergic conjunctivitis
Tranylcypromine	For the treatment of major depressive episode without melancholia
Isoflurane	For induction and maintenance of general anesthesia
Ethotoin	For the control of tonic-clonic (grand mal) and complex partial (psychomotor) seizures
Tretinoin	For the the induction of remission in patients with acute promyelocytic leukemia (APL), French-American-British (FAB) classification M3 (including the M3 variant); For the topical treatment of acne vulgaris, flat warts and other skin conditions (psoriasis, ichthyosis congenita, icthyosis vulgaris, lamellar icthyosis, keratosis palmaris et plantaris, epidermolytic hyperkeratosis, senile comedones, senile keratosis, keratosis follicularis (Darier's disease), and basal cell carcinomas.); For palliative therapy to improve fine wrinkling, mottled hyperpigmentation, roughness associated with photodamage
Hexachlorophene	For use as a surgical scrub and a bacteriostatic skin cleanser. It may also be used to control an outbreak of gram-positive infection where other infection control procedures have been unsuccessful
Dolasetron	For the prevention of nausea and vomiting associated with emetogenic cancer chemotherapy, including initial and repeat courses of chemotherapy. Also used for the prevention of postoperative nausea and vomiting. This drug can be used intravenously for the treatment of postoperative nausea and vomiting
Clopidogrel	For the reduction of atherosclerotic events (myocardial infarction, stroke, and vascular death) in patients with atherosclerosis documented by recent stroke, recent myocardial infarction, or established peripheral arterial disease
Tetracycline	Used to treat bacterial infections such as Rocky Mountain spotted fever, typhus fever, tick fevers, Q fever, rickettsialpox and Brill-Zinsser disease. May be used to treat infections caused by Chlamydiae spp., B. burgdorferi (Lyme disease), and upper respiratory infections caused by typical (S. pneumoniae, H. influenzae, and M. catarrhalis) and atypical organisms (C. pneumoniae, M. pneumoniae, L. pneumophila). May also be used to treat acne. Tetracycline may be an alternative drug for people who are allergic to penicillin
Meropenem	For use as single agent therapy for the treatment of the following infections when caused by susceptible isolates of the designated microorganisms: &lt;b&gt;complicated skin and skin structure infections&lt;/b&gt; due to &lt;i&gt;Staphylococcus aureus&lt;/i&gt; (b-lactamase and non-b-lactamase producing, methicillin-susceptible isolates only), &lt;i&gt;Streptococcus pyogenes&lt;/i&gt;, &lt;i&gt;Streptococcus agalactiae&lt;/i&gt;, viridans group streptococci, &lt;i&gt;Enterococcus faecalis&lt;/i&gt; (excluding vancomycin-resistant isolates), &lt;i&gt;Pseudomonas aeruginosa&lt;/i&gt;, &lt;i&gt;Escherichia coli&lt;/i&gt;, &lt;i&gt;Proteus mirabilis&lt;/i&gt;, &lt;i&gt;Bacteroides fragilis&lt;/i&gt; and &lt;i&gt;Peptostreptococcus&lt;/i&gt; species; &lt;b&gt;complicated appendicitis and peritonitis&lt;/b&gt; caused by viridans group streptococci, &lt;i&gt;Escherichia coli&lt;/i&gt;, &lt;i&gt;Klebsiella pneumoniae&lt;/i&gt;, &lt;i&gt;Pseudomonas aeruginosa&lt;/i&gt;, &lt;i&gt;Bacteroides fragilis&lt;/i&gt;, &lt;i&gt;B. thetaiotaomicron&lt;/i&gt;, and &lt;i&gt;Peptostreptococcus&lt;/i&gt; species. Also for use in the treatment of bacterial meningitis caused by &lt;i&gt;Streptococcus pneumoniae&lt;/i&gt;, &lt;i&gt;Haemophilus influenzae&lt;/i&gt; (b-lactamase and non-b-lactamase-producing isolates), and &lt;i&gt;Neisseria meningitidis&lt;/i&gt;
Potassium Chloride	For use as an electrolyte replenisher and in the treatment of hypokalemia
Irinotecan	For the treatment of metastatic colorectal cancer (first-line therapy when administered with 5-fluorouracil and leucovorin). Also used in combination with cisplatin for the treatment of extensive small cell lung cancer. Irinotecan is currently under investigation for the treatment of metastatic or recurrent cervical cancer. Also used in combination with fluorouracil and leucovorin for the treatment of patients with metastatic adenocarcinoma of the pancreas after disease progression following gemcitabine-based therapy.
Methimazole	For the treatment of hyperthyroidism, goiter, Graves disease and psoriasis
Mometasone	The inhaler is indicated for the maintenance treatment of asthma as prophylactic therapy. The nasal spray is indicated for the treatment of the nasal symptoms of seasonal allergic and perennial allergic rhinitis
Metyrosine	For use in the treatment of patients with pheochromocytoma, for preoperative preparation of patients for surgery, management of patients when surgery is contraindicated, and chronic treatment of patients with malignant pheochromocytoma
Clavulanate	For use with Amoxicillin, clavulanic acid is suitable for the treatment of infections with &lt;i&gt;Staph. aureus&lt;/i&gt; and &lt;i&gt;Bacteroides fragilis&lt;/i&gt;, or with beta-lactamase producing &lt;i&gt;H. influenzae&lt;/i&gt; and &lt;i&gt;E. coli&lt;/i&gt;
Olopatadine	For the treatment of ocular itching associated with allergic conjunctivitis
Hydrocortamate	Used topically as an antiinflammatory in the treatment of steroid-responsive dermatose
Alprostadil	For palliative, not definitive, therapy to temporarily maintain the patency of the ductus arteriosus until corrective or palliative surgery can be performed in neonates who have congenital heart defects and who depend upon the patent ductus for survival. Also for the treatment of erectile dysfunction due to neurogenic, vasculogenic, psychogenic, or mixed etiology
Clidinium	For the treatment of peptic ulcer disease and also to help relieve abdominal or stomach spasms or cramps due to colicky abdominal pain, diverticulitis, and irritable bowel syndrome
Malathion	For patients infected with Pediculus humanus capitis (head lice and their ova) of the scalp hair
Etoposide	For use in combination with other chemotherapeutic agents in the treatment of refractory testicular tumors and as first line treatment in patients with small cell lung cancer. Also used to treat other malignancies such as lymphoma, non-lymphocytic leukemia, and glioblastoma multiforme
Hydroflumethiazide	Used as adjunctive therapy in edema associated with congestive heart failure, hepatic cirrhosis, and corticosteroid and estrogen therapy. Also used in the management of hypertension either as the sole therapeutic agent or to enhance the effect of other antihypertensive drugs in the more severe forms of hypertension
Tirofiban	For treatment, in combination with heparin, of acute coronary syndrome, including patients who are to be managed medically and those undergoing PTCA or atherectomy
Oxcarbazepine	For use as monotherapy or adjunctive therapy in the treatment of partial seizures in adults with epilepsy and as adjunctive therapy in the treatment of partial seizures in children ages 4-16 with epilepsy
Propiomazine	Propiomazine is largely used for its antihistamininc sleep inducing effects in treating insomnia
Roxithromycin	Used to treat respiratory tract, urinary and soft tissue infections
Nalidixic Acid	For the treatment of urinary tract infections caused by susceptible gram-negative microorganisms, including the majority of &lt;i&gt;E. Coli&lt;/i&gt;, &lt;i&gt;Enterobacter&lt;/i&gt; species, &lt;i&gt;Klebsiella&lt;/i&gt; species, and &lt;i&gt;Proteus&lt;/i&gt; species
Phenelzine	Phenelzine is indicated for the treatment of nonendogenous, neurotic or atypical depression for patients that do not tolerate other forms of therapy
Polymyxin B Sulfate	For treatment of infections of the urinary tract, meninges, and blood stream, caused by susceptible strains of &lt;i&gt;Pseudomonas aeruginosa&lt;/i&gt;
Propantheline	For the treatment of enuresis. It has also been used for hyperhidrosis, and cramps or spasms of the stomach, intestines or bladder
Estradiol	Estradiol is indicated for the treatment of moderate to severe vasomotor symptoms and vulvar and vaginal atrophy due to menopause, for the treatment of hypoestrogenism due to hypogonadism, castration, or primary ovarian failure, and for the prevention of post-menopausal osteoarthritis. It is also used for the treatment of breast cancer (for palliation only) in appropriately selected women and men with metastatic disease, and for the treatment of advanced androgen-dependent carcinoma of the prostate (for palliation only)
Mefenamic acid	For the treatment of rheumatoid arthritis, osteoarthritis, dysmenorrhea, and mild to moderate pain, inflammation, and fever
Cryptenamine	For the treatment of hypertension
Marimastat	For the treatment of various cancer
Acyclovir	For the treatment and management of herpes zoster (shingles), genital herpes, and chickenpox.
Naproxen	For the treatment of rheumatoid arthritis, osteoarthritis, ankylosing spondylitis, tendinitis, bursitis, and acute gout. Also for the relief of mild to moderate pain and the treatment of primary dysmenorrhea
Gadopentetate dimeglumine	For use with magnetic resonance imaging (MRI) in adults, and pediatric patients (2 years of age and older) to visualize lesions with abnormal vascularity in the brain (intracranial lesions), spine and associated tissues as well as lesions with abnormal vascularity in the head and neck. Also used to facilitate the visualization of lesions with abnormal vascularity in the body (excluding the heart)
Perindopril	For the treatment of mild to moderate essential hypertension, mild to moderate congestive heart failure, and to reduce the cardiovascular risk of individuals with hypertension or post-myocardial infarction and stable coronary disease.
Uracil mustard	Used for its antineoplastic properties
Tripelennamine	Used for the symptomatic relief of hypersensitivity reactions, coughs, and the common cold
Haloprogin	Used to treat fungal (Tinea) skin infections such as athlete's foot, jock itch, ringworm, and tinea versicolor
Primidone	For the treatment of epileps
Sulfasalazine	For the treatment of Crohn's disease and rheumatoid arthritis as a second-line agent
Candesartan cilexetil	May be used as a first line agent to treat uncomplicated hypertension, isolated systolic hypertension and left ventricular hypertrophy. May be used as a first line agent to delay progression of diabetic nephropathy. Candesartan may be also used as a second line agent in the treatment of congestive heart failure, systolic dysfunction, myocardial infarction and coronary artery disease in those intolerant of ACE inhibitors
Tolazoline	For the treatment of pulmonary artery anomalie
Gentamicin	For treatment of serious infections caused by susceptible strains of the following microorganisms: &lt;i&gt;P. aeruginosa&lt;/i&gt;, &lt;i&gt;Proteus&lt;/i&gt; species (indole-positive and indole-negative), &lt;i&gt;E. coli&lt;/i&gt;, &lt;i&gt;Klebsiella-Enterobactor-Serratia&lt;/i&gt; species, &lt;i&gt;Citrobacter&lt;/i&gt; species and &lt;i&gt;Staphylococcus&lt;/i&gt; species (coagulase-positive and coagulase-negative)
Tazarotene	Used to treat psoriasis, acne and sun damaged skin (photodamage)
Fenoldopam	For the in-hospital, short-term (up to 48 hours) management of severe hypertension when rapid, but quickly reversible, emergency reduction of blood pressure is clinically indicated, including malignant hypertension with deteriorating end-organ function
Halazepam	Used to relieve anxiety, nervousness, and tension associated with anxiety disorders
Alfentanil	For the management of postoperative pain and the maintenance of general anesthesia
Colistin	For the treatment of acute or chronic infections due to sensitive strains of certain gram-negative bacilli, particularly &lt;i&gt;Pseudomonas aeruginosa&lt;/i&gt;
Dicyclomine	For the treatment of functional bowel/irritable bowel
Minaprine	For the treatment of depressio
Pentoxifylline	For the treatment of patients with intermittent lameness or immobility arising from chronic occlusive arterial disease of the limbs
Proparacaine	Used as a local (ophthalmic) anesthetic
Indapamide	For the treatment of hypertension, alone or in combination with other antihypertensive drugs, as well as for the treatment of salt and fluid retention associated with congestive heart failure or edema from pregnancy (appropriate only in the management of edema of pathologic origin during pregnancy when clearly needed). Also used for the management of edema as a result of various causes
Tropicamide	Indicated to induce mydriasis (dilation of the pupil) and cycloplegia (paralysis of the ciliary muscle of the eye) in diagnostic procedures, such as measurement of refractive errors and examination of the fundus of the eye
Biperiden	For use as an adjunct in the therapy of all forms of parkinsonism and control of extrapyramidal disorders secondary to neuroleptic drug therapy
Ribavirin	Indicated for the treatment of chronic Hepatitis C virus (HCV) infection in combination with other antiviral agents with the intent to cure or achieve a sustained virologic response (SVR). Typically added to improve SVR and reduce relapse rates 
Phenylbutazone	For the treatment of backache and ankylosing spondyliti
Fentanyl	For the treatment of cancer patients with severe pain that breaks through their regular narcotic therapy
Meloxicam	For symptomatic treatment of arthritis and osteoarthritis
Sodium lauryl sulfate	SLS is used as a surfactant in shampoos and toothpastes. SLS also has microbicidal activities against both enveloped (Herpes simplex viruses, HIV-1, Semliki Forest virus) and nonenveloped (papillomaviruses, reovirus, rotavirus and poliovirus) viruses, although it has not been approved for this use
Orciprenaline	For the treatment of bronchospasm, chronic bronchitis, asthma, and emphysema
Rosoxacin	For the treatment of bacterial infection of respiratory tract, urinary tract, GI, CNS and immuno compromised patients
