drug	usage
Colfosceril palmitate	Colfosceril palmitate is indicated for the treatment of respiratory distress syndrome (RDS) in premature infants. The official label is referred as a intratracheal suspension for prophylactic treatment of infants of less than 1350 grams of birth weight under risk of developing RDS, or in infants with birth weight greater than 1350 grams with pulmonary immaturity, or as rescue treatment of infants that already developed RDS.[L1109] The central feature of RDS is a surfactant deficiency due to lung immaturity. This lung condition is more frequently presented due to risk factors like prematurity, delayed lung maturation caused by maternal diabetes or male gender, or surfactant dysfuntion due to perinatal asphyxia, pulmonary infection or delivery without labor.[T70
Diiodohydroxyquinoline	Used in the treatment of amoebiasis
Calcium carbimide	Calcium carbimide has not been approved by the FDA but the intended indication is for the treatment of alcoholism.[T74] This medication was marketed in Canada, United Kingdom and Europe under the trade name of Temposil for the sole use of alcoholism treatment.[L1114
Paraldehyde	Paraldehyde was used historically as a sedative and hypnotic [A19735]. It has been used in the treatment of seizures as an anticonvulsant [A19736]
Stiripentol	Indicated for use in conjunction with clobazam and valproate as adjunctive therapy of refractory generalized tonic-clonic seizures in patients with severe myoclonic epilepsy in infancy (SMEI, Dravet’s syndrome) whose seizures are not adequately controlled with clobazam and valproate
Eslicarbazepine acetate	Eslicarbazepine acetate is indicated as adjunctive therapy in the treatment of partial-onset seizures that are not adequately controlled with conventional therapy in epileptic patients.
Zucapsaicin	Indicated to be used in conjunction with oral COX-2 inhibitors or NSAIDs for the relief of severe pain in adult patients with osteoarthritis of the knee, not controlled with oral COX-2 inhibitors or NSAIDs alone, for a duration of no more than three months.
Aurothioglucose	Aurothioglucose is indicated for the adjunctive treatment of early active adult and juvenile type rheumatoid arthritis that is not adequately controlled by other anti-inflammatory agents and conservative measures like salicylate, glucocorticoids, etc. [L1925, L1937]. In chronic, advanced cases of rheumatoid arthritis, such gold therapy is not demonstrated to be as valuable
Peginterferon beta-1a	For the treatment of patients with relapsing forms of multiple sclerosis
Dienogest	Indicated for use as the treatment of endometriosis alone and as a contraceptive in combination with ethinylestradiol.
Medrogestone	Medrogestone is indicated as adjunct to treat endometial shedding in menopausal women, to treat secondary amenorrhea, to induce menses and to treat dysfunctional uterine bleeding in adult and adolescent women.[T76
Potassium Citrate	For the management of renal tubular acidosis, hypocitraturic calcium oxalate nephrolithiasis, and uric acid lithiasis with or without calcium stones
Chorionic Gonadotropin (Human)	For the treatment of prepubertal cryptorchidism (not due to anatomical obstruction), for the treatment of selected cases of hypogonadotropic hypogonadism (hypogonadism secondary to a pituitary deficiency) in males and for the induction of ovulation and pregnancy in the anovulatory, infertile woman in whom the cause of anovulation is secondary and not due to primary ovarian failure, and who has been appropriately pretreated with human menotropins
Brexpiprazole	As an adjunctive treatment of major depressive disorder (MDD) and for treatment of schizophrenia.
Chromic chloride	For use as a supplement to intravenous solutions given for total parenteral nutrition (TPN)
Copper	For use in the supplementation of total parenteral nutrition and in contraception with intrauterine devices [FDA Label] [L801]
Cupric Chloride	For use as a supplement to intravenous solutions given for total parenteral nutrition (TPN)
Gadoteric acid	Gadoteric acid is indicated for intravenous use with magnetic resonance imaging (MRI) in brain (intracranial), spine and associated tissues in adult and pediatric patients (2 years of age and older) to detect and visualize areas with disruption of the blood brain barrier (BBB) and/or abnormal vascularity
Iothalamic acid	Conray is indicated for use in excretory urography, cerebral angiography, peripheral arteriography, venography, arthrography, direct cholangiography, endoscopic retrograde cholangiopancreatography, contrast enhancement of computed tomographic brain images, cranial computerized angiotomography, intravenous digital subtraction angiography and arterial digital subtraction ang
Ioversol	Optiray 350 is indicated in adults for peripheral and coronary arteriography and left ventriculography. Optiray 350 is also indicated for contrast enhanced computed tomographic imaging of the head and body, intravenous excretory urography, intravenous digital subtraction angiography and venography. Optiray 350 is indicated in children for angiocard
Ioxilan	When administered  intra-arterially, Ioxilan is indicated for the following diagnostic tests: cerebral arteriography (300 mgI/mL),  coronary arteriography and left ventriculography (350 mgI/mL), visceral angiography(350 mgI/mL), aortography(350 mgI/mL), and peripheral arteriography(350
Isosulfan blue	Isosulfan Blue is a synthetic visual lymphatic imaging agent. Isosulfan blue upon subcutaneous administration, delineates the lymphatic vessels draining the region of injection. It is an adjunct to lymphography in: primary and secondary lymphedema of the extremities; chyluria, chylous ascites or chylothorax; lymph node involvement by primary or secondary neoplasm; lymph node response to therapeutic modalities.
Technetium Tc-99m mebrofenin	Technetium Tc 99m Mebrofenin is indicated as a hepatobiliary imaging agent
Technetium Tc-99m medronate	Technetium Tc 99m Medronate is indicated for use as a bone imaging agent to delineate areas of altered osteogenesis
Technetium Tc-99m oxidronate	Technetium Tc-99m oxidronate is indicated in adult and pediatric patients to be used in skeletal imaging for diagnosis of areas that can present altered osteogenesis. When administered intravenously, it is able to generate a clear image of the bones which allows the physician to diagnose any bone problem.[L1141] It is important to point out that this drug has to be manipulated only under the service of a nuclear specialist.[L1140] The approved indications for a bone scan are 1) visualization of tumor metastasis in bone, 2) osteomyelitis, 3) fracture, 4) stress fracture, 5) avascular necrosis, 6) osteoporosis and 7) prosthetic joint evaluation. From all the major indications, the detection of a metastatic disease is the most common because it presents a 95% of sensitivity and lesion detection can be done 6 months earlier than with X-ray studies.[L1139
Oxygen	Oxygen therapy in clinical settings is used across diverse specialties, including various types of anoxia, hypoxia or dyspnea and any other disease states and conditions that reduce the efficiency of gas exchange and oxygen consumption such as respiratory illnesses, trauma, poisonings and drug overdoses. Oxygen therapy tries to achieve hyperoxia [L745] to reduce the extent of hypoxia-induced tissue damage and malfunction.
Protamine sulfate	Protamine sulfate is usually administered to reverse the large dose of heparin administered during certain surgeries, especially heart surgery.
Sincalide	As the product Kinevac (FDA), sincalide is used for the following indications: 1) to stimulate gallbladder contraction, as may be assessed by various methods of diagnostic imaging, or to obtain by duodenal aspiration a sample of concentrated bile for analysis of cholesterol, bile salts, phospholipids, and crystals; (2) to stimulate pancreatic secretion (especially in conjunction with secretin) prior to obtaining a duodenal aspirate for analysis of enzyme activity, composition, and cytology; (3) to accelerate the transit of a barium meal through the small bowel, thereby decreasing the time and extent of radiation associated with fluoroscopy and x-ray examination of the intestinal tract
Sonidegib	Sonidegib is approved for use in the US and EU for treatment of adults with locally advanced basal cell carcinoma (BCC) that has recurred post surgery or radiation therapy.  It is also approved for adult patients with BCC who are not eligible for surgery or radiation therapy. (2
Uridine triacetate	Marketed as the product Xuriden (FDA), uridine triacetate is indicated for the treatment of hereditary orotic 
Water	For diluting or dissolving drugs for intravenous, intramuscular or subcutaneous injection, according to instructions of the manufacturer of the drug to be administered [FDA Label]
Iron saccharate	Iron sucrose is elemental iron as an injection. It replenishes body iron stores in patients with iron deficiency
Florbetaben (18F)	Florbetaben is a radioactive diagnostic agent indicated for Positron Emission Tomography (PET) imaging of the brain to estimate β-amyloid neuritic plaque density in adult patients with cognitive impairment who are being evaluated for Alzheimer’s Disease (AD) and other causes of cognitive decline
Florbetapir (18F)	Florbetapir 18F is indicated for Positron Emission Tomography (PET) imaging of the brain to estimate β-amyloid neuritic plaque density in adult patients with cognitive impairment who are being evaluated for Alzheimer's Disease (AD) and other causes of cognitive decline
Flutemetamol (18F)	Flutemetamol F18 is indicated for Positron Emission Tomography (PET) imaging of the brain to estimate β amyloid neuritic plaque density in adult patients with cognitive impairment who are being evaluated for Alzheimer's disease (AD) or other causes of cognitive decline.
Nitrogen	Liquid nitrogen is used mainly as a cryogenic agent for the treatment of various benign and malignant skin lesions.
Sodium Chloride	This intravenous solution is indicated for use in adults and pediatric patients as a source of electrolytes and water for hydration. Also, designed for use as a diluent and delivery system for intermittent intravenous administration of compatible drug additives.
Sodium Citrate	Used as an anticoagulant during plasmophoresis as well as a neutralizing agent in the treatment of upset stomach and acidic urine [FDA Label] [L788] [L789]
Helium	For use in patients who are not getting enough oxygen into their blood due to blockages in the lungs from pathological conditions or injuries. Suggested potential benefit in upper airway obstruction, in severe asthma, and in exacerbations of COPD/COLD. Helium may be used in place of carbon monoxide during laparoscopic surgeries as it lowers the risk of developing respiratory acidosis in selected patients.
Iopromide	Iopromide, as the product Iovist, is indicated for use as an X-ray contrast agent in the following pr
Carbon dioxide	Carbon dioxide is commonly used as an insufflation gas for minimal invasive surgery (laparoscopy, endoscopy, and arthroscopy) to enlarge and stabilize body cavities to provide better visibility of the surgical area. It has been used also in cryotherapy and as respiratory stimulant before and after anesthesia.  It could be used also in expansion of blood vessels if required, to increase carbon dioxide level after rapid breathing, and to stimulate breathing after a period of nonbreathing.
Trypan blue free acid	Trypan blue is indicated for use as an aid in ophthalmic surgery by staining the epiretinal membranes during ophthalmic surgical vitrectomy procedures, facilitating removal of the tissue.
Technetium Tc-99m tetrofosmin	Technetium-99m tetrofosmin is indicated for the diagnosis of heart abnormalities by exercise myocardial scintigraphy. The exercise myocardial scintigraphy is an established method for the diagnosis of the severity of coronary artery disease.[A31592] This method allows distinguishing regions of reversible myocardial ischemia in the presence or absence of infarcted myocardium following rest and stress conditions.[L1147] The use of technetium-99m tetrofosmin is mainly used to assess myocardial perfusion in ischemia and infarction.[L1146
Technetium Tc-99m sestamibi	Technetium Tc 99m Sestamibi is indicated for: 1) detecting coronary artery disease by localizing myocardial ischemia (reversible defects) and infarction (non-reversible defects); and 2) evaluating myocardial function and developing information for use in patient management decisions
Technetium Tc-99m exametazime	Technetium Tc99m exametazime scintigraphy (with or without methylene blue stabilization) may be useful as an adjunct in the detection of altered regional cerebral perfusion in stroke. Tc99m exametazime without methylene blue stabilization is indicated for leukocyte labeled scintigraphy as an adjunct in the localization of intra-abdominal infection and inflammatory bowel disease
Technetium Tc-99m disofenin	Technetium Tc99m Disofenin is indicated as a hepatobiliary imaging agent. Hepatolite is indicated in the diagnosis of acute cholecystitis as well as to rule out the occurrence of acute cholecystitis in suspected patients with right upper quadrant pain, fever, jaundice, right upper quadrant tenderness and mass or rebound tenderness, but not limited to these signs and symptoms
Technetium Tc-99m pyrophosphate	For use as a skeletal imaging agent used to demonstrate areas of altered osteogenesis, and a cardiac imaging agent used as an adjunct in the diagnosis of acute myocardial infarction [FDA Label]. May also be used to image gated blood pools and detect gastrointetinal bleeding
Etizolam	Indicated for the treatment of generalized anxiety disorder with depression, panic disorder and insomnia
Dosulepin	Indicated in the treatment of symptoms of depressive illness, especially where an anti-anxiety effect is required
Dasabuvir	Dasabuvir, in combination with [DB09296], [DB09297], and [DB00503] (as Viekira Pak) is indicated for the treatment of patients with HCV genotype 1a with [DB00811] or genotype 1b without [DB00811] including those with compensated cirrhosis [FDA Label]
Viloxazine	Indicated for the treatment of clinical depression
Lorpiprazole	In 2016, lorpiprazole was classified in the "Chemical structure-related drug-like criteria of global approved drugs" as an antipsychotic and anxiolytic.[L1167] An antipsychotic is a medication used to treat a state of delusion, hallucination, paranoia or disordered thought. On the other hand, an anxiolytic is a medication used for the treatment of severe, chronic or debilitating anxiety. The anxiety state can be defined as an unpleasant state of tension, apprehension or uneasiness.[T77
Mepiprazole	For the treatment of anxiety neuroses
Lobeglitazone	Lobeglitazone was approved by the Ministry of Food and Drug Safety (South Korea) in 2013, and is being monitored by postmarketing surveillance until 2019. Lobeglitazone is not approved for use by either the Food and Drug Administration (USA), Health Canada, or by the European Medicines Agency for use in the management of diabetes
Moxisylyte	By the WHO, moxisylyte is indicated for the symptomatic management of sequelae of cerebral infarction or hemorrhage.[T91] The cerebral infarction is characterized by the blockage of the artery either by the formation of a thrombus or an embolus.
Pegloticase	For the treatment of chronic gout in adult patients refractory to conventional therapy
Pholcodine	Pholcodine is indicated as a cough suppressant for the temporary relief of non-productive dry cough. It is stated to present a required label indication of "temporary relief of dry cough."[L1200] Cough is the respiratory movement that occurs after an irritation signal is transmitted to the central nervous system and further stimulates the medulla oblongata. This stimulation causes a motor output that is sent through motoneurons to the respiratory muscles. A non-productive cough is a type of cough characterized by the absence of sputum, and it has a large inspiration that will cause continuous coughing
Piracetam	Indicated in adult patients suffering from myoclonus of cortical origin, irrespective of aetiology, and should be used in combination with other anti-myoclonic therapies [L1125]
Limaprost	Limaprost is used for the improvement of various ischemic symptoms such as ulcer, pain and feeling of coldness associated with thromboangiitis obliterans as well as improvement of subjective symptoms (pain and numbness of lower legs) and gait ability associated with acquired lumbar spinal canal stenosis (in patients with bilateral intermittent claudication showing normal SLR test result)
Loxoprofen	Loxoprofen is non-steroidal anti-inflammatory medication (NSAID) indicated for pain and inflammation related to musculoskeletal and joint disorders [L1226].   In addition to its effects on pain, it is an antipyretic and anti-inflammatory medication [L1227]
Dexibuprofen	Similar indications as ibuprofen; to be used as a symptomatic treatment for pain and inflammation in rheumatic disease such as osteoarthritis and rheumatoid arthritis, as well as other musculoskeletal disorders.  It is also used to reduce oral postoperative pain and alleviate fever
Dexketoprofen	For short-term treatment of mild to moderate pain, including dysmenorrhoea, musculoskeletal pain and toothache [L1302].
Tolfenamic Acid	In the information for tolfenamic acid, it is stated that this drug, being an NSAID, is effective in treating the pain associated with the acute attack of migraines in adults.[L1293
Clonixin	Used primarily in the treatment of chronic arthritic conditions and certain soft tissue disorders associated with pain and inflammation
Bisoxatin	For use in the treatment of constipation in the absence of bowel obstruction and for surgical preparation of the colon [L926]
Nicorandil	Indicated for the prevention and treatment of chronic stable angina pectoris and reduction in the risk of acute coronary syndromes.
Polaprezinc	Peptic ulcer disease, dyspepsia [L1308]
Fibrinogen Human	For the treatment of acute bleeding episodes in patients with congenital fibrinogen deficiency, including afibrinogenemia and hypofibrinogenemia
Blonanserin	Used for the treatment of schizophrenia [L1097]
Melperone	For the treatment of schizophrenia, sleep, disorders, agitation and mentally confused states [L1317, L1319, L1322]. 
Zotepine	Zotepine, like other atypical antipsychotics, is considered as the first-line treatment in newly diagnosed schizophrenia. It is usually thought to be an option of choice for managing acute schizophrenic episodes when discussion with the patient is not possible. Zotepine, as an atypical antipsychotic, is used in patients who are suffering unacceptable side effects from conventional antipsychotics or in relapse patients that were inadequately controlle
Barnidipine	Indicated for the treatment of mild to moderate essential hypertension and management of chronic stable angina
Conestat alfa	For the treatment of acute attacks of hereditary angioedema (HAE) due to C1 esterase inhibitor deficiency in adults
Aranidipine	Aranidipine has been used for many years to treat angina pectoris and hypertension.[A31895
Azelnidipine	For the treatment of hypertension
Benidipine	Benidipine is a potent and long-lasting drug indicated for the treatment of cardiovascular diseases such as hypertension, renoparenchymal hypertension and angina pectoris.[A31950
Cilnidipine	Cilnidipine is indicated for the management of hypertension for end-organ protection.[L1436] It is reported to be useful in elderly patients and in those with diabetes and albuminuria. Cilnidipine has been increasingly used in patients with chronic kidney
Efonidipine	For the treatment of hypertension
Lacidipine	Indicated for the treatment of hypertension either alone or in combination with other antihypertensive agents, including β-adrenoceptor antagonists, diuretics, and ACE-inhibitors [L1126]
Levamlodipine	For the treatment of hypertension and angina [L1483].
Manidipine	For the treatment of hypertension
Methylene blue	Methylene blue has several indications in 
Moxonidine	For the treatment of mild to moderate essential or primary hypertension [L1025]. Effective as most first-line antihypertensives when used as monotherapy [A27137]
Pirlindole	For the treatment of major de
Toloxatone	For the treatment of major depressive disorder.
Dextran	Dextran is used as the restoration of blood mass during surgical interventions if there is hypovolemia due to trauma or dehydration. It is as well used after the presence of hemorrhage in cases of blood loss to a level inferior to 15% of the blood mass, if compatibility test cannot be completed or when blood lots need to be tested for pathogen detection. Dextran is also used for the prevention of profound postoperative venous thrombosi
Tegafur	Indicated for the treatment of cancer usually in combination with other biochemically modulati
Gimeracil	Gimeracil is used as an adjunct to antineoplastic therapy. When used within the product Teysuno, gimeracil is indicated for the treatment of adults with advanced gastric (stomach) cancer when given in combination with cisplatin
Bemiparin	Bemiparin is indicated in the following cases: To prevent blood clots in the veins after general abdominal surgery in patients with a moderate risk of venous thromboembolism; in the prevention of the thromboembolic disease in non-surgical patients; prevention of clotting in the extracorporeal circuit during hemodialysis; to prevent blood clots in the veins after a major orthopedic surgery in patients with high risk of venous thromboembolism; secondary prevention of venous thromboembolism; recurrence in patients with deep vein thrombosis; transient prevention and treatment of deep vein thrombosis (DVT) [L1463]
Reviparin	By the FDA, reviparin is indicated for the treatment of deep vein which may lead to pulmonary embolism in pediatric patients. It is also indicated for the long-term treatment of acute deep vein thrombosis with or without pulmonary embolism in pregnant patients.[L1469
Parnaparin	Used in the prevention and treatment of venous thromboembolism (deep vein thrombosis and pulmonary embolism) and in the treatment of myocardial infarction
Certoparin	Used in the prevention and treatment of venous thromboembolism (deep vein thrombosis and pulmonary embolism) and in the treatment of myocardial infarction
Imidafenacin	Used in the treatment of overactive bladder [FDA Label]
Patiromer	For the treatment of hyperkalemia
Idarucizumab	For use in patients treated with Dabigatran when reversal of the anticoagulant effects of dabigatran is needed for emergency surgery/urgent procedures and in life-threatening or uncontrolled bleeding
Lixisenatide	For use as an antihyperglycemic agent in the treatment of T2DM [FDA Label]
Technetium Tc-99m tilmanocept	Indicated with or without scintigraphic imaging for lymphatic mapping using a handheld gamma counter to locate lymph nodes draining a primary tumor site in patients with solid tumors for which this procedure is a component of intraoperative management [FD
Strontium ranelate	Strontium ranelate is therapeutically indicated for the treatement of severe osteoperosis in: a) postmenopasual women, and b) adult men, who are at high risk of fractures, for whom treatment with other medical products approved for the treatment of osteoperosis is not possible due to, for example, contraindications or intolerance
Picosulfuric acid	Indicated for cleansing of the colon as a preparation for colonoscopy in adults [FDA Label]
Phenylacetic acid	For use as adjunctive therapy for the treatment of acute hyperammonemia and associated encephalopathy in patients with deficiencies in enzymes of the urea cycle
Ubidecarenone	The diet supplements containing ubidecarenone are indicated, as stated in the product label, to assist individuals with cardiovascular complaints including congestive heart failure and systolic hypertension. In the product, ubidecarenone is used to increase the cardiac input as well as for the prevention of several other diseases like Parkinson, fibromyalgia, migraine, periodontal disease and diabetes, based on preclinical studies.[L1064] It is important to highlight that these products are not FDA approved and it is recommended to use under discretion
Eluxadoline	For the treatment of irritable bowel syndrome with diarrhea (IBS-D)
Doxofylline	Indicated for the treatment of chronic obstructive pulmonary disease (COPD), bronchial asthma and pulmonary disease with spastic bronchial component
Artesunate	For the treatment of severe malaria caused by *Plasmodium falciparum* in adults and children [L891
Bismuth Subcitrate	For the treatment of peptic ulcer and gastro-oesophageal reflux diseas
Sodium aurothiomalate	As anti-inflammatory agent for the treatment of arthritis. Disease-modifying antirheumatic drug, DMARD
Choline C 11	Choline C11 is indicated for its use in positron emission tomography (PET) imaging in patients with suspected prostate cancer recurrence and non-informative bone scintigraphy, computerized tomography or magnetic resonance imaging.[FDA label, A32037
Activated charcoal	Used as a antidote to treat poisonings following excessive oral ingestion of certain medications or poisons.
Fimasartan	Used for the treatment of hypertension and heart failure [A20319]
Lumacaftor	When given in combination with [DB08820] as the fixed dose combination product Orkambi, lumacaftor is indicated for the treatment of cystic fibrosis (CF) in patients age 6 years and older who are homozygous for the F508del mutation in the CFTR gene [FDA Label]
Magnesium Trisilicate	For the treatment of pepti
Molsidomine	The indications for use of molsidomine include ischemic heart disease, angina, chronic heart failure, and pulmonary hypertension [L1370, L1371]
