drug	usage
Paramethasone	For the treatment of all conditions in which corticosteroid therapy is indicated except adrenal-deficiency states for which its lack of sodium-retaining properties makes it less suitable than hydrocortisone with supplementary fludrocortisone
Sodium bicarbonate	Sodium bicarbonate is used for the treatment of metabolic acidosis which may occur in severe renal disease, uncontrolled diabetes, circulatory insufficiency due to shock or severe dehydration, extracorporeal circulation of blood, cardiac arrest and severe primary lactic acidosis. Also is indicated in severe diarrhea which is often accompanied by a significant loss of bicarbonate. Further indicated in the treatment of certain drug intoxications, including barbiturates (where dissociation of the barbiturateprotein complex is desired), in poisoning by salicylates or methyl alcohol and in hemolytic reactions requiring alkalinization of the urine to diminish nephrotoxicity of blood pigments
Yohimbine	Indicated as a sympatholytic and mydriatic. Impotence has been successfully treated with yohimbine in male patients with vascular or diabetic origins and psychogenic origins
Bezafibrate	For the treatment of primary hyperlipidaemia types IIa, IIb, III, IV and V (Fredrickson classification) corresponding to groups I, II and III of the European Atherosclerosis Society guidelines - when diet alone or improvements in lifestyle such as increased exercise or weight reduction do not lead to an adequate response. Also for the treatment of secondary hyperlipidaemias, e.g. severe hypertriglyceridemias, when sufficient improvement does not occur after correction of the underlying disorder (e.g. diabetes mellitus)
Colchicine	For treatment and relief of pain in attacks of acute gouty arthritis
Drospirenone	For the prevention of pregnancy in women who elect an oral contraceptive
Digitoxin	For the treatment and management of congestive cardiac insufficiency, arrhythmias and heart failure
Magnesium salicylate	Magnesium salicylate is a common analgesic and non-steroidal anti-inflammatory drug (NSAID) used to treat mild to moderate muscular pai
Salsalate	For relief of the signs and symptoms of rheumatoid arthritis, osteoarthritis and related rheumatic disorders
Neostigmine	Neostigmine is used for the symptomatic treatment of myasthenia gravis by improving muscle tone
Choline magnesium trisalicylate	Choline magnesium trisalicylate is used to reduce pain and inflammation caused by conditions such as arthritis. This medication is also used to treat fever in adults
Methotrimeprazine	For the treatment of psychosis, particular those of schizophrenia, and manic phases of bipolar disorder
Danazol	For the treatment of endometriosis and fibrocystic breast disease (in patients unresponsive to simple measures). Also used for the prophylactic treatment of all types of hereditary angioedema in males and females
Clenbuterol	Used as a bronchodilator in the treatment of asthma patients.
Bambuterol	For the prevention and reversal of bronchospasm in patients 12 years of age and older with asthma and reversible bronchospasm associated with bronchitis and emphysema
Tiotropium	Used in the management of chronic obstructive pulmonary disease (COPD)
Ciclesonide	For the treatment of nasal symptoms associated with seasonal and perennial allergic rhinitis in adults and adolescents 12 years of age and older
Pranlukast	Used as an adjunct to the standard therapy of inhaled steroids with inhaled long- and/or short-acting beta-agonists.
Theobromine	theobromine is used as a vasodilator, a diuretic, and heart stimulant. And similar to caffeine, it may be useful in management of fatigue and orthostatic hypotension
Cefepime	For the treatment of pneumonia (moderate to severe) caused by &lt;i&gt;Streptococcus pneumoniae&lt;/i&gt;, including cases associated with concurrent bacteremia, &lt;i&gt;Pseudomonas aeruginosa&lt;/i&gt;, &lt;i&gt;Klebsiella pneumoniae&lt;/i&gt;, or &lt;i&gt;Enterobacter&lt;/i&gt; species. Also for empiric treatment of febrile neutropenic patients and uncomplicated and complicated urinary tract infections (including pyelonephritis) caused by &lt;i&gt;Escherichia coli&lt;/i&gt; or &lt;i&gt;Klebsiella pneumoniae&lt;/i&gt;, when the infection is severe, or caused by &lt;i&gt;Escherichia coli&lt;/i&gt;, &lt;i&gt;Klebsiella pneumoniae&lt;/i&gt;, or &lt;i&gt;Proteus mirabilis&lt;/i&gt;, when the infection is mild to moderate, including cases associated with concurrent bacteremia with these microorganisms. Also for the treatment of uncomplicated skin and skin structure infections caused by &lt;i&gt;Staphylococcus aureus&lt;/i&gt; (methicillin-susceptible strains only) or &lt;i&gt;Streptococcus pyogenes&lt;/i&gt; and complicated intra-abdominal infections (used in combination with metronidazole) caused by &lt;i&gt;Escherichia coli&lt;/i&gt;, viridans group streptococci, &lt;i&gt;Pseudomonas aeruginosa&lt;/i&gt;, &lt;i&gt;Klebsiella pneumoniae&lt;/i&gt;, &lt;i&gt;Enterobacter&lt;/i&gt; species, or &lt;i&gt;Bacteroides fragilis&lt;/i&gt;
Cefacetrile	Cefacetrile is a broad-spectrum first generation cephalosporin antibiotic effective in Gram-positive and Gram-negative bacterial infections
Ceftibuten	Used to treat acute bacterial exacerbations of chronic bronchitis (ABECB), acute bacterial otitis media, pharyngitis, and tonsilitis
Cefpodoxime	For the treatment of patients with mild to moderate infections caused by susceptible strains of the designated microorganisms
Acenocoumarol	For the treatment and prevention of thromboembolic diseases. More specifically, it is indicated for the for the prevention of cerebral embolism, deep vein thrombosis, pulmonary embolism, thromboembolism in infarction and transient ischemic attacks. It is used for the treatment of deep vein thrombosis and myocardial infarction
Antrafenine	Antrafenine is used as an anti-inflammatory and analgesic agent for the relief of mild to moderate pain
Testosterone propionate	Testosterone propionate is often used for muscle mass building. The original medical indication is for the treatment of androgen deficiency in male adults either in hypogonadism or andropause.[L1161] Nowadays testosterone propionate is indicated for its use in heifers in order to stimulate maximal growth.[L1160
Paromomycin	For the treatment of acute and chronic intestinal amebiasis (it is not effective in extraintestinal amebiasis). Also for the management of hepatic coma as adjunctive therapy
Nitroxoline	Nitroxoline is an antibiotic agent
Stepronin	Strepronin is a mucolytic (expectorant) drug
Aminophenazone	Formerly widely used as an antipyretic and analgesic in rheumatism, neuritis, and common colds. Currently used to measure total body water
Alizapride	Alizapride is used in the treatment of nausea and vomiting, including postoperative nausea and vomiting.
Ajmaline	For use as an antiarrhythmic agent
Amrinone	Used in the treatment of congestive heart failure
Oxybenzone	Used as an ingredient in sunscreen and other cosmetics
Almitrine	For the treatment of chronic obstructive pulmonary disease
Allylestrenol	Allylestrenol was designed to be used for miscarriage prevention, prevention of premature labour and has been investigated for possible use in men for treatment for benign prostatic hyperplasia
Cholestyramine	Indicated as adjunctive therapy to diet for the reduction of elevated serum cholesterol in patients with primary hypercholesterolemia (elevated low density lipoprotein [LDL] cholesterol) who do not respond adequately to diet. Also for the relief of pruritus associated with partial biliary obstruction
Methadyl Acetate	Used mainly in the treatment of narcotic dependence
Antipyrine	Antipyrine is an analgesic often used to test effects of other drugs on liver enzymes.
Alfacalcidol	Alfacalcidol is an active metabolite of Vitamin D, which performs important functions in regulation of the calcium balance and the bone metabolism
Glutethimide	For the treatment of insomnia
Phenazopyridine	For the symptomatic relief of pain, burning, urgency, frequency, and other discomforts arising from irritation of the lower urinary tract mucosa caused by infection, trauma, surgery, endoscopic procedures, or the passage of sounds or catheters
Gamma Hydroxybutyric Acid	Used as a general anesthetic, to treat conditions such as insomnia, clinical depression, narcolepsy, and alcoholism, and to improve athletic performance.
Heroin	Used in the treatment of acute pain, myocardial infarction, acute pulmonary oedema, and chronic pain
Fencamfamine	For the the treatment of depressive fatigue in convalescence and other debilitated states as well as in the treatment of depressive day-time fatigue, lack of concentration and lethargy
Ethylmorphine	Ethylmorphine is an analgesic used for pain relief
Camazepam	Camazepam has been used in placebo controlled studies for the treatment of patients suffering from anxiety and depression.
Difenoxin	Motofen(R) is a combination of atropine, an anticholinergic drug, and difenoxin, an antidiarrheal drug. It has been used in many countries for many years as a second line opioid-agonist antidiarrheal, which exists an intermediate between loperamide and parag
Delorazepam	Mainly used as an anti-anxiety agent. Studies have found delorazepam to be more effective in the first 4 weeks of use than antidepressants; however, after 4 weeks, antidepressants showed superior anti-anxiety effects. [Wikipedia] Anti-anxiety effects also appear to be weaker in elderly pati
Flunitrazepam	For short-term treatment of severe insomnias, that are not responsive to other hypnotics
Fenproporex	Fenproporex is used as an appetite suppressant, and anti-obesity agent [2]; however, due to substance abuse potential, it is an illicit substance in many countries. In some countries, such as Brazil, it is still prescribed -- often in the form of diet pills (ie. Brazilian Diet Pills) which combine amphetamines, benzodiazepines, antidepressants, diuretics and la
Dihydrocodeine	Dihydrocodeine is used for the treatment of moderate to severe pain, including post-operative and dental pain [2]. It  can also be used to treat chronic pain [1], breathlessness and c
Cloxazolam	Used primarily as an anti-anxiety agent. Typically used short term, and may be given as a single dose of up to 100mcg/kg to reduce anxiety and tension experienced prior to surgery.
Bromazepam	For the short-term treatment of insomnia, short-term treatment of anxiety or panic attacks, if a benzodiazepine is required, and the alleviation of the symptoms of alcohol- and opiate-withdrawal
Clotiazepam	For the treatment of anxiety disorders
Chloral hydrate	Mainly used as a hyponotic in the treatment of insomnia; however, it is only effective as a hypnotic for short-term use. May be used as a routine sedative preoperatively to decrease anxiety and cause sedation and/or sleep with respiration depression or cough reflex.
Fludiazepam	Used for the short-term treatment of anxiety disorders
Attapulgite	When used in medicine, it physically binds to acids and toxic substances in the stomach and digestive tract. For that reason, it has often been used in antidiarrheal medications. Attapulgite is an adsorbent.
Kaolin	Used for upset stomach and diarrhea, a traditional medicine used in China, South America and Africa. Kaolin is also used to treat AIDs-related diarrhea. Kaolin based bandages are also under investigation.
Dextroamphetamine	Used to treat attention deficit hyperactivity disorder (ADHD)
Methamphetamine	For the treatment of Attention Deficit Disorder with Hyperactivity (ADHD) and exogenous obesity
Metrizamide	Metrizamide is used for lumbar, thoracic, cervical, and total columnar myelography to determine the presence of abnormalities in the spinal column, spinal canal, and central nervous system (CNS) as well as for cisternography by direct injection using standard radiologic techniques to visualize the basal cistern of the brain. For computerized tomography (CT) of the intracranial subarachnoid spaces and for ventriculography by direct injection using standard radiologic techniques to visualize the cerebral ventricles. Also used in pediatric angiocardiography to visualize lesions or malformations of the heart and obstructions or anomalies of the major thoracic vessels. Also used in adult peripheral arteriography to visualize specific regions of the vascular system and blood flow in such areas to help in the diagnosis and evaluation of neoplasms (known or suspected) or vascular diseases (congenital or acquired) that may cause changes in normal vascular anatomy or physiology. Metrizamide is also indicated in adults for intravenous digital arteriography of head and neck
Phendimetrazine	Used in the management of exogenous obesity as a short term adjunct (a few weeks) in a regimen of weight reduction based on caloric restriction
Oxprenolol	Used in the treatment of hypertension, angina pectoris, arrhythmias, and anxiety
Sulfamerazine	A sulfanilamide that is used as an antibacterial agent. It can be used to treat bronchitis, prostatitis and urinary tract infections
Sulfamethazine	For the treatment bacterial infections causing bronchitis, prostatitis and urinary tract infections
Liotrix	May be used to treat primary, secondary or tertiary hypothyroidism. May also be used to suppress thyroid stimulating hormone (TSH) secretion in patients with simple (nontoxic) goiter, subacute or chronic lymphocytic thyroiditis multinodular goiter, and in the management of thyroid cancer. May be used in conjunction with other antithyroid agents to treat thyrotoxicosis to prevent goitrogenesis and hypothyroidism. May also be used for differential diagnosis of suspected mild hyperthyroidism or thyroid gland autonomy
Thyroglobulin	For the treatment of hypothyroidism (deficiency in the production of thyroid hormone)
Ursodeoxycholic acid	The drug reduces cholesterol absorption and is used to dissolve (cholesterol) gallstones in patients who want an alternative to surgery
Ketazolam	Ketazolam could be used for the treatment of anxiety. In approved countries, it is indicated for the treatment of anxiety, tension, irritability and similar stress related symptoms
Prazepam	For the treatment of anxiety disorders
Quazepam	Used to treat insomnia
Everolimus	Everolimus is indicated for the treatment of postmenopausal women with advanced hormone receptor-positive, HER2-negative breast cancer (advanced HR+ BC) in combination with exemestane, after failure of treatment with letrozole or ana
Solifenacin	For the treatment of overactive bladder with symptoms of urge urinary incontinence, urgency, and urinary frequency
Iron	Used in preventing and treating iron-deficiency anemia
Zinc	Zinc can be used for the treatment and prevention of zinc deficiency/its consequences, including stunted growth and acute diarrhea in children, and slowed wound healing. It is also utilized for boosting the immune system, treating the common cold and recurrent ear infections, as well as preventing lower respiratory tract infections [
Cinolazepam	For the management of anxiety disorders or for the short-term relief of the symptoms of anxiety or anxiety associated with depressive symptoms
Nitrazepam	Used to treat short-term sleeping problems (insomnia), such as difficulty falling asleep, frequent awakenings during the night, and early-morning awakening
Cilastatin	Combined intravenously with imipenem in order to protect it from dehydropeptidase and prolong its antibacterial effect
Imipenem	For the treatment of bacterial infections caused by susceptible bacteria
Probucol	Used to lower LDL and HDL cholesterol
Tiaprofenic acid	Tiaprofenic acid is used to treat pain, especially arthritic pain
Lopinavir	Indicated in combination with other antiretroviral agents for the treatment of HIV-infection
Bacampicillin	For infections at the following sites: upper and lower respiratory tract; skin and soft tissue; urinary tract and acute uncomplicated gonococcal urethritis, when due to sensitive strains of the following organisms:  Gram-positive: streptococci (including &lt;i&gt;S. faecalis&lt;/i&gt; and &lt;i&gt;S. pneumoniae&lt;/i&gt;) and nonpenicillinase-producing staphylococci; Gram-negative: &lt;i&gt;H. influenzae&lt;/i&gt;, &lt;i&gt;N. gonorrhoeae&lt;/i&gt;, &lt;i&gt;E. coli&lt;/i&gt;, &lt;i&gt;P. mirabilis&lt;/i&gt;, &lt;i&gt;Salmonellae&lt;/i&gt; and &lt;i&gt;Shigellae&lt;/i&gt;
Meticillin	Used to treat infections caused by susceptible Gram-positive bacteria, particularly beta-lactamase-producing organisms such as &lt;i&gt;Staphylococcus aureus&lt;/i&gt; that would otherwise be resistant to most penicillins
Pivampicillin	or the treatment of respiratory tract infections (including acute bronchitis, acute exacerbations of chronic bronchitis and pneumonia); ear, nose and throat infections; gynecological infections; urinary tract infections (including acute uncomplicated gonococcal urethritis) when caused by non penicillinase-producing susceptible strains of the following organisms: gram-positive organisms, e.g., streptococci, pneumococci and staphylococci; gram-negative organisms, e.g., H. influenzae, N. gonorrhoeae, E. coli, P. mirabilis.
Pivmecillinam	Used to treat infections due to mecillinam-sensitive organisms such as urinary tract infections, salmonellosis and typhoid fever
Tazobactam	Used in combination with piperacillin to broaden the spectrum of piperacillin antibacterial action
Ticarcillin	For the treatment of bacterial infections
Propericiazine	For use as adjunctive medication in some psychotic patients. Propericiazine (Pericyazine)is used for the control of residual prevailing hostility, impulsiveness and aggressiveness.
Deferasirox	For the treatment of chronic iron overload due to blood transfusions (transfusional hemosiderosis) in patients 2 years of age and older
Valganciclovir	Valganciclovir is an antiviral medication used for the treatment of cytomegalovirus infections
Hydroxychloroquine	For the suppressive treatment and treatment of acute attacks of malaria due to &lt;i&gt;Plasmodium vivax&lt;/i&gt;, &lt;i&gt;P. malariae&lt;/i&gt;, &lt;i&gt;P. ovale&lt;/i&gt;, and susceptible strains of &lt;i&gt;P. falciparum&lt;/i&gt;. It is also indicated for the treatment of discoid and systemic lupus erythematosus, and rheumatoid arthritis
Amyl Nitrite	For the rapid relief of angina pectoris
Erythrityl Tetranitrate	For the prevention of angina
Acepromazine	Acepromazine was first used in humans in the 1950s as an antipsychotic agent. It is now rarely used in humans. Acepromazine is frequently used in animals as a sedative and antiemetic. Its principal value is in quietening and calming anxious animals
Aceprometazine	Aceprometazine is often used in combination with meprobamate for the treatment of sleep disorders
Alverine	Used to relieve cramps or spasms of the stomach and intestines. It is also useful in treating irritable bowel syndrome (IBS) and similar conditions. It can also be used to help relieve period pain. Alverine citrate is also under investigation to increase the cytotoxic effects of the proteasome inhibitor MG132 on breast cancer cells.
Molindone	Molindone is used for the management of the manifestations of psychotic disorders
Phenindamine	Used to treat sneezing, runny nose, itching, watery eyes, hives, rashes, itching, and other symptoms of allergies and the common cold
Pheniramine	Pheniramine is an antihistamine used to treat allergic conditions such as hay fever or urticaria
Pipotiazine	For the maintenance treatment of chronic non-agitated schizophrenic patients
Thioproperazine	For the treatment of all types of acute and chronic schizophrenia, including those which did not respond to the usual neuroleptics; manic syndromes
Thiothixene	For the management of schizophrenia
Zuclopenthixol	Used in the management of acute psychoses such as mania or schizophrenia. However, the use of zuclopenthixol acetate in psychiatric emergencies as an alternative to standard treatments (haloperidol, clotiapine, etc.) should be cautioned, since well executed and documented trials of zuclopenthixol acetate for this use have yet to be conducted. Zuclopenthixol acetate is not intended for long-term use
Isopropamide	For the treatment of a wide range of gastrointestinal disorders, including such conditions as peptic ulcer, gastritis, hyperchlorhydria, functional diarrhea, irritable or spastic colon, pyloroduodenal irritability, pylorospasm, acute nonspecific gastroenteritis, biliary dyskinesia and chronic cholelithiasis, duodenitis, gastrointestinal spasm; it may also be used to treat genitourinary spasm
Pargyline	For the treatment of moderate to severe hypertension
Lincomycin	Lincomycin is an antibiotic used in the treatment of staphylococcal, streptococcal, and &lt;i&gt;Bacteroides fragilis&lt;/i&gt; infections
Etoricoxib	For the treatment of rheumatoid arthritis, osteoarthritis, ankylosing spondylitis, chronic low back pain, acute pain and gout
Sorbitol	Used as a non-stimulant laxative via an oral suspension or enema
Roflumilast	Roflumilast is indicated as a treatment to reduce the risk of COPD exacerbations in patients with severe COPD associated with chronic bronchitis and a history of exacerbations. Roflumilast is not a bronchodilator and is not indicated for the relief of acute bronchospasm
Topiroxostat	Indicated for the treatment of gout and hyperurcemia in Japan
Prasterone	DHEA is taken as a supplement for a variety of unsubstantiated indications. The following indications have shown promise and are backed up by some scientific evidence: schizophrenia (DHEA may be more effective in women than men); improving the appearance of older people’s skin (taking DHEA by mouth seems to increase skin thickness and moisture, and decrease facial “age spots” in elderly men and women); improving ability to achieve an erection in men with sexual dysfunction. Additionally, DHEA has shown promise in improving symptoms of lupus (SLE). Taking DHEA by mouth along with conventional treatment may help reduce the number of times symptoms flare up and may allow a reduction in the dose of prescription drugs needed. DHEA may also help SLE symptoms such as muscle ache and mouth ulcers. DHEA also seems to strengthen bones in SLE patients being treated with high-dose steroids (corticos
Dalfopristin	For the treatment of bacterial infections (usually in combination with quinupristin)
Pantothenic acid	Studied for the treatment of many uses such as treatment of testicular torsion, diabetic ulceration, wound healing, acne, obesity, diabetic peripheral polyneuropathy. It has also been investigated for its hypolipidemic effects and as cholesterol lowering agent
D-glucose	Glucose pharmaceutical formulations (oral tablets, injections) are indicated for caloric supply and carbohydrate supplementation in case of nutrient deprivation. It is also used for metabolic disorders such as hypoglycemia.[L787
Taurine	The use of diet supplements containing taurine is indicated for the nutritional support of infants and young pediatric patients requiring total parenteral nutrition via central or peripheral routes. The usage of diet supplements containing taurine prevents nitrogen and weight loss or to treat negative nitrogen balance in pediatric patients where the alimentary tract cannot be done through oral, gastrostomy or jejunostomy administration, there is impaired gastrointestinal absorption or protein requirements are substantially increased.[FDA label
Equilin	For the treatment of moderate to severe vasomotor symptoms associated with the menopause, atrophic vaginitis, osteoporosis, hypoestrogenism due to hypogonadism, castration, primary ovarian failure, breast cancer (for palliation only), and Advanced androgen-dependent carcinoma of the prostate (for palliation only
Calcipotriol	For the treatment of moderate plaque psoriasis in adults
Vorinostat	For the treatment of cutaneous manifestations in patients with cutaneous T-cell lymphoma who have progressive, persistent or recurrent disease on or following two systemic therapies
Terlipressin	Commonly used to stop bleeding of varices in the food pipe (oesophagus)
Cholic Acid	Oral cholic acid is indicated for: treatment of bile acid synthesis disorders due to single enzyme defects; and as adjunctive treatment of peroxisomal disorders including Zellweger spectrum disorders in patients who exhibit manifestations of liver disease, steatorrhea or complications from decreased fat soluble vitamin absorption.
Fusidic Acid	For the treatment of bacterial infections
Resveratrol	Being investigated for the treatment of Herpes labialis infections (cold sores)
Oxitriptan	For use as an antidepressant, appetite suppressant, and sleep aid
Pidolic Acid	There is currently no clinically approved and/or marketed medicine that relies upon pidolic acid as an active ingredient for any formal therapeutic in
Acetylcholine	Used to obtain miosis of the iris in seconds after delivery of the lens in cataract surgery, in penetrating keratoplasty, iridectomy and other anterior segment surgery where rapid miosis may be required
Flavin adenine dinucleotide	Used to treat eye diseases caused by vitamin B2 deficiency, such as keratitis and blepharitis
Acetic acid	Used to treat infections in the ear canal
Oteracil	Oteracil is used as an adjunct to antineoplastic therapy. When used within the product Teysuno, oteracil is indicated for the treatment of adults with advanced gastric (stomach) cancer when given in combination with cisplatin
Phenol	Phenol is primarily indicated for minor sore throat pain, sore mouth, minor mouth irritation, and pain associated with canker sores. Additionally, phenol is indicated in the treatment of focal spasticity.
Hemin	Used in the management of porphyria attacks, particularly in acute intermittent porphyria
Deoxycholic Acid	For improvement in appearance of moderate to severe fullness associated with submental fat in adults.
Tromethamine	For the prevention and correction of metabolic acidosis
